URL,Walk Score (out of 100),Transit Score (out of 100),Bike Score (out of 100),Elementary School Name,Elementary School Score (out of 10),Middle School Name,Middle School Score (out of 10),High School Name,High School Score (out of 10),Address,Price,Beds,Baths,Sq Ft,Est. Monthly Payment,Time on Redfin,Year Built,Property Type,Style,HOA,Lot Size,Garage Spaces,Floor Type,Heat Type,Cool Type,Tax Amount,Zip Code,Noise Level,Flood Factor,Fire Factor,Heat Factor,Wind Factor
https://www.redfin.com/NV/Las-Vegas/4919-Mount-Pleasant-Ln-89113/home/29582118,14,38,30,Lucille S Rogers Elementary School,8,Grant Sawyer Middle School,4,Durango High School,2,"4919 Mount Pleasant Ln,Las Vegas,NV89113",649750,2,2.5,1734,"$4,854 ",7 days,1994,"Residential, Townhouse",Two Story,$770 ,"3,049",2,Laminate,"Central, Gas","Central Air, Electric",2318,89113,Medium,Minimal,Minimal,Severe,Minimal
https://www.redfin.com/NV/Las-Vegas/7148-Montcliff-Ave-89147/home/29547749,68,42,43,Pat Diskin Elementary School,5,Clifford J Lawrence Junior High School,5,Spring Valley High School,5,"7148 Montcliff Ave,Las Vegas,NV89147",425000,4,2,1509,"$2,642 ",7 days,1980,"Residential, Single Family Residence",One Story,0,"6,534",2,"Carpet, Ceramic Tile, Tile","Central, Gas","Central Air, Electric",1166,89147,Medium,Minimal,Minimal,Severe,Minimal
https://www.redfin.com/NV/Las-Vegas/10582-Mandarino-Ave-89135/home/29898569,21,22,29,,,Victoria Fertitta Middle School,8,Durango High School,2,"10582 Mandarino Ave,Las Vegas,NV89135",925000,2,2.5,2777,"$6,235 ",7 days,2001,"Residential, Single Family Residence",One Story,$275 ,"8,712",2,"Laminate, Tile","Central, Gas, Multiple Heating Units","Central Air, Electric, 2 Units",5057,89135,Medium,Minimal,Severe,Severe,Minimal
https://www.redfin.com/NV/Las-Vegas/5927-Trail-Roundup-Ln-89113/home/29585366,10,35,39,Lucille S Rogers Elementary School,8,Grant Sawyer Middle School,4,Durango High School,2,"5927 Trail Roundup Ln,Las Vegas,NV89113",549000,3,2,1578,"$3,439 ",7 days,1996,"Residential, Single Family Residence",One Story,0,"6,534",2,"Hardwood, Tile","Central, Gas","Central Air, Gas",1823,89113,Medium,Minimal,Moderate,Severe,Minimal
https://www.redfin.com/NV/Las-Vegas/11832-Saverio-Ave-89138/home/144625830,6,0,27,Billy And Rosemary Vassiliadis Elementary School,10,Sig Rogich Middle School,8,Palo Verde High School,6,"11832 Saverio Ave,Las Vegas,NV89138",888888,3,3,2280,"$6,003 ",7 days,2017,"Residential, Single Family Residence",One Story,$121 ,"8,712",2,"Carpet, Ceramic Tile","Central, Gas","Central Air, Electric",6711,89138,Medium,Minimal,Major,Severe,Minimal
https://www.redfin.com/NV/Las-Vegas/7229-Tempest-Pl-89145/home/29222618,70,34,45,Helen M Smith Elementary School,7,Walter Johnson Junior High School,7,Bonanza High School,3,"7229 Tempest Pl,Las Vegas,NV89145",365000,3,2,1358,"$2,278 ",7 days,1977,"Residential, Single Family Residence",One Story,0,"6,970",2,"Carpet, Tile","Central, Electric","Central Air, Electric",1105,89145,Medium,Minimal,Minimal,Severe,Minimal
https://www.redfin.com/NV/Las-Vegas/1521-Padova-Dr-89117/home/29523906,63,40,53,Piggott Academy of International Studies,7,Walter Johnson Junior High School,7,Bonanza High School,3,"1521 Padova Dr,Las Vegas,NV89117",569999,4,3,2172,"$3,654 ",7 days,1984,"Residential, Single Family Residence",Two Story,0,"7,405",2,"Carpet, Hardwood, Linoleum, Tile, Vinyl","Central, Gas","Central Air, Electric",2895,89117,Medium,Minimal,Minimal,Severe,Minimal
https://www.redfin.com/NV/Las-Vegas/7814-Harbour-Towne-Ave-89113/home/29583264,3,34,26,Lucille S Rogers Elementary School,8,Grant Sawyer Middle School,4,Durango High School,2,"7814 Harbour Towne Ave,Las Vegas,NV89113",699999,2,2.5,1914,"$5,063 ",7 days,1989,"Residential, Townhouse",One Story,$608 ,"3,485",2,Luxury Vinyl Plank,"Central, Gas","Central Air, Electric",3162,89113,Medium,Minimal,Minimal,Severe,Minimal
https://www.redfin.com/NV/Las-Vegas/2008-Summit-Pointe-Dr-89117/home/29527436,48,36,40,Piggott Academy of International Studies,7,Walter Johnson Junior High School,7,Bonanza High School,3,"2008 Summit Pointe Dr,Las Vegas,NV89117",580000,4,3,2288,"$3,790 ",8 days,1994,"Residential, Single Family Residence",Two Story,$96 ,"5,227",3,"Carpet, Ceramic Tile, Luxury Vinyl Plank","Central, Gas","Central Air, Electric",2652,89117,Medium,Minimal,Minimal,Severe,Minimal
https://www.redfin.com/NV/Las-Vegas/2784-Belcastro-St-89117/home/29537078,39,37,54,R Guild Gray Elementary School,4,Clifford J Lawrence Junior High School,5,Spring Valley High School,5,"2784 Belcastro St,Las Vegas,NV89117",724900,5,3.5,2576,"$4,920 ",8 days,1977,"Residential, Single Family Residence","Two Story, Tri-Level",0,21780,2,"Carpet, Ceramic Tile","Central, Electric","Central Air, Electric",6956,89117,Medium,Minimal,Minimal,Severe,Minimal
https://www.redfin.com/NV/Las-Vegas/528-Lacabana-Beach-Dr-89138/home/28973224,10,0,39,Linda Rankin Givens Elementary School,9,Sig Rogich Middle School,8,Palo Verde High School,6,"528 Lacabana Beach Dr,Las Vegas,NV89138",714999,4,3,2530,"$4,673 ",8 days,2003,"Residential, Single Family Residence",Two Story,$55 ,"5,663",2,"Carpet, Tile","Central, Gas","Central Air, Electric",4041,89138,Medium,Moderate,Severe,Major,Minimal
https://www.redfin.com/NV/Las-Vegas/8496-Birthstone-Ave-89147/home/29560394,60,39,44,Roger M Bryan Elementary School,6,Clifford J Lawrence Junior High School,5,Spring Valley High School,5,"8496 Birthstone Ave,Las Vegas,NV89147",349900,2,2.5,1326,"$2,262 ",8 days,1997,"Residential, Single Family Residence",Two Story,$43 ,"3,920",2,Carpet,"Central, Gas","Central Air, Electric",1490,89147,Medium,Minimal,Minimal,Severe,Minimal
https://www.redfin.com/NV/Las-Vegas/4774-Willow-Glen-Dr-89147/home/29562057,42,38,36,Frank Kim Elementary School,5,Clifford J Lawrence Junior High School,5,Durango High School,2,"4774 Willow Glen Dr,Las Vegas,NV89147",425000,4,3,2067,"$2,733 ",8 days,1994,"Residential, Single Family Residence",Two Story,$20 ,"6,098",3,Tile,"Central, Gas","Central Air, Electric",2019,89147,Medium,Minimal,Minimal,Severe,Minimal
https://www.redfin.com/NV/Las-Vegas/3973-El-Camino-Rd-89103/home/29546066,66,41,67,C H Decker Elementary School,4,Kenny C Guinn Middle School,5,Durango High School,2,"3973 El Camino Rd,Las Vegas,NV89103",395000,2,2,1162,"$2,465 ",8 days,1984,"Residential, Single Family Residence",One Story,0,"6,098",2,"Ceramic Tile, Linoleum, Vinyl","Central, Electric","Central Air, Gas",1196,89103,Medium,Minimal,Minimal,Severe,Minimal
https://www.redfin.com/NV/Las-Vegas/6537-Wild-River-Dr-89108/home/29192064,62,39,47,Vail Pittman Elementary School,5,Frank F Garside Junior High School,3,Western High School,1,"6537 Wild River Dr,Las Vegas,NV89108",400000,3,2,1574,"$2,533 ",8 days,1994,"Residential, Single Family Residence",One Story,0,"4,792",2,"Linoleum, Tile, Vinyl","Central, Gas","Central Air, Electric",1654,89108,Medium,Minimal,Minimal,Severe,Minimal
https://www.redfin.com/NV/Las-Vegas/6213-Laredo-St-89146/home/29538542,52,38,44,R Guild Gray Elementary School,4,Kenny C Guinn Middle School,5,Bonanza High School,3,"6213 Laredo St,Las Vegas,NV89146",750000,3,3,1925,"$4,666 ",8 days,1960,"Residential, Single Family Residence",One Story,0,40075.2,2,"Hardwood, Tile","Electric, High Efficiency","Central Air, Electric",2096,89146,Medium,Minimal,Minimal,Severe,Minimal
https://www.redfin.com/NV/Las-Vegas/9816-Dryden-Ct-89148/home/109634253,50,37,35,Kathy L. Batterman Elementary School,8,Victoria Fertitta Middle School,8,Sierra Vista High School,2,"9816 Dryden Ct,Las Vegas,NV89148",540000,5,3,2460,"$3,606 ",9 days,2015,"Residential, Single Family Residence",Two Story,$48 ,"3,485",2,"Carpet, Ceramic Tile, Laminate","Central, Gas","Central Air, Electric",3900,89148,Medium,Minimal,Severe,Severe,Minimal
https://www.redfin.com/NV/Las-Vegas/3943-Tirana-Way-89103/home/29543771,76,44,51,C H Decker Elementary School,4,Kenny C Guinn Middle School,5,Education W Clark High School,3,"3943 Tirana Way,Las Vegas,NV89103",400000,3,3,1964,"$2,797 ",9 days,1988,"Residential, Townhouse",Two Story,$271 ,"3,675",2,"Laminate, Tile","Central, Gas","Central Air, Electric",1570,89103,Medium,Minimal,Minimal,Severe,Minimal
https://www.redfin.com/NV/Las-Vegas/10982-Village-Ridge-Ln-89135/home/29913008,13,30,24,Judy & John L Goolsby Elementary School,9,Victoria Fertitta Middle School,8,Durango High School,2,"10982 Village Ridge Ln,Las Vegas,NV89135",649900,3,2,1885,"$4,179 ",9 days,2002,"Residential, Single Family Residence",One Story,$57 ,"5,663",2,"Laminate, Tile","Central, Gas","Central Air, Electric",2761,89135,Medium,Minimal,Major,Severe,Minimal
https://www.redfin.com/NV/Las-Vegas/4512-Long-Horse-Ct-89147/home/29559187,41,39,32,Keith C & Karen W Hayes Elementary School,6,Clifford J Lawrence Junior High School,5,Durango High School,2,"4512 Long Horse Ct,Las Vegas,NV89147",495000,4,2.5,2062,"$3,128 ",9 days,1997,"Residential, Single Family Residence",Two Story,0,"7,405",2,"Carpet, Ceramic Tile","Central, Gas","Central Air, Electric",1969,89147,Medium,Minimal,Minimal,Severe,Minimal
https://www.redfin.com/NV/Las-Vegas/1016-Monticello-Dr-89107/home/29232210,74,39,55,Rose Warren Elementary School,5,Frank F Garside Junior High School,3,Bonanza High School,3,"1016 Monticello Dr,Las Vegas,NV89107",590000,4,1.5,3688,"$3,612 ",9 days,1961,"Residential, Single Family Residence",One Story,0,"6,098",1,"Carpet, Laminate, Tile","Central, Gas","Central Air, Electric",954,89107,Medium,Minimal,Minor,Severe,Minimal
https://www.redfin.com/NV/Las-Vegas/921-Percy-Arms-St-89138/home/28986596,63,0,54,Linda Rankin Givens Elementary School,9,Sig Rogich Middle School,8,Palo Verde High School,6,"921 Percy Arms St,Las Vegas,NV89138",519999,3,2.5,1723,"$3,380 ",9 days,2005,"Residential, Single Family Residence",Two Story,$48 ,"6,098",2,"Carpet, Ceramic Tile","Central, Gas","Central Air, Electric",2619,89138,Medium,Moderate,Severe,Major,Minimal
https://www.redfin.com/NV/Las-Vegas/160-Nene-Ct-89144/home/29113577,31,22,28,John W Bonner Elementary School,9,Sig Rogich Middle School,8,Palo Verde High School,6,"160 Nene Ct,Las Vegas,NV89144",675000,4,2.5,2481,"$4,388 ",9 days,1998,"Residential, Single Family Residence",Two Story,$60 ,"7,405",3,"Carpet, Laminate, Tile","Central, Gas, Solar","Gas, High Efficiency",3431,89144,Medium,Minimal,Severe,Severe,Minimal
https://www.redfin.com/NV/Las-Vegas/3905-San-Joaquin-Ave-89102/home/29463810,71,39,53,Dr. C Owen Roundy Elementary School,4,James Cashman Middle School,4,Education W Clark High School,3,"3905 San Joaquin Ave,Las Vegas,NV89102",210000,3,2,1358,"$1,323 ",9 days,1963,"Residential, Single Family Residence",One Story,0,"6,534",2,Carpet,"Central, Gas","Central Air, Electric",792,89102,Medium,Minimal,Minimal,Severe,Minimal
https://www.redfin.com/NV/Las-Vegas/8711-Villa-Ariel-Ln-89147/home/29559332,54,37,44,Patricia A Bendorf Elementary School,6,Clifford J Lawrence Junior High School,5,Spring Valley High School,5,"8711 Villa Ariel Ln,Las Vegas,NV89147",415000,2,2,1098,"$2,720 ",24 days,2000,"Residential, Townhouse",One Story,$150 ,"3,049",2,"Carpet, Ceramic Tile, Tile","Central, Gas","Central Air, Electric",1026,89147,Medium,Minimal,Minimal,Severe,Minimal
https://www.redfin.com/NV/Las-Vegas/9789-Galahad-Point-Ct-89147/home/29556827,35,40,51,Keith C & Karen W Hayes Elementary School,6,Victoria Fertitta Middle School,8,Spring Valley High School,5,"9789 Galahad Point Ct,Las Vegas,NV89147",385000,3,2,1461,"$2,440 ",24 days,1997,"Residential, Single Family Residence",One Story,0,"8,712",3,"Carpet, Ceramic Tile, Laminate","Central, Gas","Central Air, Gas",1616,89147,Medium,Minimal,Minor,Severe,Minimal
https://www.redfin.com/NV/Las-Vegas/1309-Bittersweet-Cir-89128/home/29200097,33,41,38,Edythe & Lloyd Katz Elementary School,4,Ernest Becker Middle School,7,Cimarron Memorial High School,3,"1309 Bittersweet Cir,Las Vegas,NV89128",350000,3,2.5,1504,"$2,187 ",24 days,1985,"Residential, Single Family Residence",Two Story,0,"4,356",2,"Carpet, Linoleum, Vinyl","Central, Gas","Central Air, Electric",1097,89128,Medium,Minimal,Minimal,Severe,Minimal
https://www.redfin.com/NV/Las-Vegas/1815-Cape-Cod-Landing-Dr-89135/home/29320678,50,36,49,Judy & John L Goolsby Elementary School,9,Sig Rogich Middle School,8,Palo Verde High School,6,"1815 Cape Cod Landing Dr,Las Vegas,NV89135",590000,3,2.5,2909,"$3,946 ",24 days,2009,"Residential, Single Family Residence",Three Story,$153 ,"3,049",2,"Carpet, Tile","Central, Gas","Central Air, Electric",3127,89135,Medium,Minimal,Severe,Severe,Minimal
https://www.redfin.com/NV/Las-Vegas/5226-Monterey-Park-Cir-89146/home/28979661,46,38,44,Dr. C Owen Roundy Elementary School,4,Kenny C Guinn Middle School,5,Education W Clark High School,3,"5226 Monterey Park Cir Cir,Las Vegas,NV89146",385000,3,2.5,1636,"$2,591 ",24 days,2003,"Residential, Single Family Residence",Two Story,$150 ,"2,614",2,"Laminate, Tile","Central, Gas","Central Air, Electric",1626,89146,Medium,Minimal,Minimal,Severe,Minimal
https://www.redfin.com/NV/Las-Vegas/10495-Heritage-Park-Ave-89135/home/29897028,58,39,45,d'Vorre & Hall Ober Elementary School,7,Sig Rogich Middle School,8,Palo Verde High School,6,"10495 Heritage Park Ave,Las Vegas,NV89135",469999,3,2,1475,"$3,315 ",24 days,2002,"Residential, Townhouse",One Story,$304 ,"3,920",2,"Carpet, Tile","Central, Gas","Central Air, Electric",2361,89135,Medium,Minimal,Minor,Severe,Minimal
https://www.redfin.com/NV/Las-Vegas/12483-Point-Sierra-St-89138/home/167636040,4,0,16,Billy And Rosemary Vassiliadis Elementary School,10,Sig Rogich Middle School,8,Palo Verde High School,6,"12483 Point Sierra St,Las Vegas,NV89138",930000,4,3.5,2591,"$6,240 ",24 days,2020,"Residential, Single Family Residence",Two Story,$123 ,"5,227",2,"Carpet, Tile","Central, Gas, Multiple Heating Units","Central Air, Electric, 2 Units",6579,89138,Medium,Major,Severe,Major,Minimal
https://www.redfin.com/NV/Las-Vegas/800-Aquitaine-Ct-89145/home/29213575,19,38,39,John W Bonner Elementary School,9,Sig Rogich Middle School,8,Palo Verde High School,6,"800 Aquitaine Ct,Las Vegas,NV89145",975500,3,2.5,3162,"$6,526 ",25 days,1999,"Residential, Single Family Residence",One Story,$321 ,11761.2,3,"Carpet, Laminate, Tile","Central, Gas, Multiple Heating Units","Central Air, Electric",4367,89145,Medium,Minimal,Minimal,Severe,Minimal
https://www.redfin.com/NV/Las-Vegas/5925-Gipsy-Ave-89107/home/29232856,59,39,50,Red Rock Elementary School,2,Frank F Garside Junior High School,3,Western High School,1,"5925 Gipsy Ave,Las Vegas,NV89107",359999,3,2,1193,"$2,230 ",25 days,1960,"Residential, Single Family Residence",One Story,0,"6,534",2,"Carpet, Laminate","Central, Electric","Central Air, Electric",896,89107,Medium,Minimal,Minimal,Severe,Minimal
https://www.redfin.com/NV/Las-Vegas/6804-Atwood-Ave-89108/home/29131022,69,39,51,R E Tobler Elementary School,5,Irwin & Susan Molasky Junior High School,3,Cheyenne High School,1,"6804 Atwood Ave,Las Vegas,NV89108",400000,3,2,1413,"$2,492 ",25 days,1980,"Residential, Single Family Residence",One Story,0,"6,970",2,Ceramic Tile,"Central, Gas","Central Air, Electric",1163,89108,Medium,Minimal,Minimal,Severe,Minimal
https://www.redfin.com/NV/Las-Vegas/10518-Broadhead-Ct-89135/home/29587834,29,34,33,d'Vorre & Hall Ober Elementary School,7,Victoria Fertitta Middle School,8,Palo Verde High School,6,"10518 Broadhead Ct,Las Vegas,NV89135",499000,3,2.5,1698,"$3,238 ",25 days,2000,"Residential, Single Family Residence",Two Story,$57 ,"4,792",2,"Carpet, Laminate, Tile","Central, Gas","Central Air, Electric",2321,89135,Medium,Minimal,Minor,Severe,Minimal
https://www.redfin.com/NV/Las-Vegas/5197-Silica-Chalk-Ave-89115/home/166540847,47,45,50,Zel & Mary Lowman Elementary School,3,Carroll M Johnston Middle School,4,Mojave High School,1,"5197 Silica Chalk Ave,Las Vegas,NV89115",330000,3,2,1241,"$2,383 ",7 hours,2020,"Residential, Townhouse",Two Story,$240 ,"1,307",2,"Laminate, Tile","Central, Gas","Central Air, Electric",1999,89115,Medium,Minimal,Minimal,Severe,Minimal
https://www.redfin.com/NV/Las-Vegas/4048-Harris-Ave-89110/home/29385599,45,42,60,Arturo Cambeiro Elementary School,5,Roy West Martin Middle School,4,Desert Pines High School,1,"4048 Harris Ave,Las Vegas,NV89110",348000,3,2,1235,"$2,173 ",8 hours,1993,"Residential, Single Family Residence",One Story,0,"5,227",2,Carpet,"Central, Gas","Central Air, Electric",1073,89110,Medium,Minimal,Minimal,Severe,Minimal
https://www.redfin.com/NV/Las-Vegas/3412-Townhouse-Dr-89121/home/29422108,61,41,47,George E Harris Elementary School,4,C W Woodbury Middle School,2,Chaparral High School,2,"3412 Townhouse Dr,Las Vegas,NV89121",309900,3,2.5,2060,"$2,057 ",8 hours,1972,"Residential, Townhouse",Two Story,$150 ,"1,742",2,"Carpet, Linoleum, Vinyl","Central, Gas","Central Air, Electric",621,89121,Medium,Minimal,Minimal,Severe,Minimal
https://www.redfin.com/NV/Las-Vegas/4033-Russian-Rider-Dr-89122/home/29282743,9,35,26,Cynthia Cunningham Elementary School,2,Kathleen & Tim Harney Middle School,4,Chaparral High School,2,"4033 Russian Rider Dr,Las Vegas,NV89122",415000,3,2,1904,"$2,708 ",9 hours,2006,"Residential, Single Family Residence",One Story,$60 ,"5,663",2,"Carpet, Ceramic Tile, Tile","Central, Electric","Central Air, Electric",1955,89122,Low,Minimal,Moderate,Severe,Minimal
https://www.redfin.com/NV/Las-Vegas/4633-Lime-Straight-Dr-89115/home/166540814,35,44,42,J E Manch Elementary School,3,Carroll M Johnston Middle School,4,Mojave High School,1,"4633 Lime Straight Dr,Las Vegas,NV89115",280000,3,2,1298,"$2,080 ",9 hours,2019,"Residential, Townhouse",Two Story,$245 ,"1,307",2,"Carpet, Ceramic Tile","Central, Gas","Central Air, Electric",1899,89115,Medium,Minimal,Minimal,Severe,Minimal
https://www.redfin.com/NV/Las-Vegas/748-Clayton-St-89110/home/146401801,4,21,31,Kirk Adams Elementary School,5,Duane D Keller Middle School,2,Las Vegas High School,3,"748 Clayton St,Las Vegas,NV89110",450000,2,2,1098,"$3,003 ",10 hours,2018,"Residential, Single Family Residence",One Story,0,36154.8,2,Tile,"Central, Gas","Central Air, Electric",3702,89110,Medium,Minimal,Major,Severe,Minimal
https://www.redfin.com/NV/Las-Vegas/4915-Chidlaw-St-89115/unit-1/home/183991520,49,46,49,Zel & Mary Lowman Elementary School,3,Carroll M Johnston Middle School,4,Mojave High School,1,"4915 Chidlaw Ave #1,Las Vegas,NV89115",286554,2,2.5,1077,"$2,152 ",10 hours,2023,"Residential, Townhouse",Two Story,$199 ,871,1,"Carpet, Ceramic Tile","Central, Gas","Central Air, Electric",2847,89115,Medium,Minimal,Minimal,Severe,Minimal
https://www.redfin.com/NV/Las-Vegas/3069-S-Mojave-Rd-89121/home/29472831,65,43,77,Will Beckley Elementary School,3,K O Knudson Junior High School,5,Valley High School,1,"3069 S Mojave Rd,Las Vegas,NV89121",390000,3,2,1672,"$2,431 ",13 hours,1971,"Residential, Single Family Residence",One Story,0,"8,276",2,"Carpet, Ceramic Tile","Central, Gas","Central Air, Electric",1151,89121,Medium,Minimal,Minimal,Severe,Minimal
https://www.redfin.com/NV/Las-Vegas/1498-Sunburst-Dr-89110/home/29376477,4,30,27,Eileen Brookman Elementary School,4,Dr. William (bob) H Bailey Middle School,3,Eldorado High School,1,"1498 Sunburst Dr,Las Vegas,NV89110",419500,4,2.5,2212,"$2,648 ",14 hours,1988,"Residential, Single Family Residence",Two Story,0,"7,405",2,"Carpet, Ceramic Tile","Central, Electric","Central Air, Gas",1630,89110,Medium,Minimal,Moderate,Severe,Minimal
https://www.redfin.com/NV/Las-Vegas/6171-Canter-Glen-Ave-89122/home/29482181,0,15,34,Cynthia Cunningham Elementary School,2,Kathleen & Tim Harney Middle School,4,Chaparral High School,2,"6171 Canter Glen Ave,Las Vegas,NV89122",410000,2,2,1570,"$2,699 ",23 hours,2007,"Residential, Single Family Residence",One Story,$115 ,"6,970",2,"Carpet, Tile","Central, Gas","Central Air, Electric",1543,89122,Low,Minimal,Moderate,Severe,Minimal
https://www.redfin.com/NV/Las-Vegas/4051-Shetland-Pony-St-89122/home/29481807,5,34,27,Cynthia Cunningham Elementary School,2,Kathleen & Tim Harney Middle School,4,Chaparral High School,2,"4051 Shetland Pony St,Las Vegas,NV89122",435000,3,2,1925,"$2,830 ",23 hours,2008,"Residential, Single Family Residence",One Story,$60 ,"5,227",2,"Carpet, Tile","Central, Gas","Central Air, Electric",1988,89122,Low,Minimal,Moderate,Severe,Minimal
https://www.redfin.com/NV/Las-Vegas/3154-Downing-Pl-89121/home/29509354,34,40,59,Lewis E Rowe Elementary School,7,C W Woodbury Middle School,2,Del Sol High School,3,"3154 Downing Pl,Las Vegas,NV89121",540000,3,2.5,2372,"$3,396 ",27 hours,1975,"Residential, Single Family Residence",One Story,0,"6,970",2,"Carpet, Luxury Vinyl Plank, Tile","Central, Gas","Central Air, Electric",1956,89121,Medium,Minimal,Minimal,Severe,Minimal
https://www.redfin.com/NV/Las-Vegas/6380-Tumblegrass-Ct-89122/home/29030151,0,20,35,Cynthia Cunningham Elementary School,2,Kathleen & Tim Harney Middle School,4,Chaparral High School,2,"6380 Tumblegrass Ct,Las Vegas,NV89122",345000,3,2.5,1601,"$2,232 ",33 hours,2005,"Residential, Single Family Residence",Two Story,$65 ,"3,049",2,"Carpet, Linoleum, Vinyl","Central, Gas","Central Air, Electric",1211,89122,Low,Minimal,Major,Severe,Minimal
https://www.redfin.com/NV/Las-Vegas/2688-Par-Four-Ln-89142/home/29415265,35,42,43,,,Kathleen & Tim Harney Middle School,4,Chaparral High School,2,"2688 Par Four Ln,Las Vegas,NV89142",329900,3,2,1315,"$2,086 ",35 hours,1987,"Residential, Single Family Residence",One Story,$31 ,"4,792",2,Tile,"Central, Gas","Central Air, Electric",957,89142,Medium,Minimal,Minimal,Severe,Minimal
https://www.redfin.com/NV/Las-Vegas/4298-Cicada-Way-89121/home/29420357,36,44,58,George E Harris Elementary School,4,C W Woodbury Middle School,2,Chaparral High School,2,"4298 Cicada Way,Las Vegas,NV89121",419999,3,2,1598,"$2,605 ",35 hours,1974,"Residential, Single Family Residence",One Story,0,"6,534",2,"Linoleum, Vinyl","Central, Gas","Central Air, Electric",1077,89121,Medium,Minimal,Minimal,Severe,Minimal
https://www.redfin.com/NV/Las-Vegas/4079-El-Segundo-Ave-89121/home/29412790,34,44,72,Laura Dearing Elementary School,4,Jerome MacK Middle School,3,Chaparral High School,2,"4079 El Segundo Ave,Las Vegas,NV89121",345000,3,2,1296,"$2,145 ",35 hours,1964,"Residential, Single Family Residence",One Story,0,"6,970",2,"Carpet, Ceramic Tile, Laminate","Central, Gas","Central Air, Electric",946,89121,Medium,Minimal,Minimal,Severe,Minimal
https://www.redfin.com/NV/Las-Vegas/1621-Sunrise-View-Dr-89156/home/29370740,15,33,30,Mountain View Elementary School,4,Dr. William (bob) H Bailey Middle School,3,Sunrise Mountain High School,1,"1621 Sunrise View Dr,Las Vegas,NV89156",375000,3,2,1340,"$2,342 ",1 day,1991,"Residential, Single Family Residence",One Story,0,"6,098",2,"Carpet, Ceramic Tile, Linoleum, Vinyl","Central, Gas","Central Air, Electric",1155,89156,Low,Minimal,Moderate,Severe,Minimal
https://www.redfin.com/NV/Las-Vegas/4420-Dover-Straight-St-89115/home/29813962,47,45,50,Zel & Mary Lowman Elementary School,3,Carroll M Johnston Middle School,4,Mojave High School,1,"4420 Dover Straight St,Las Vegas,NV89115",345990,4,3,1618,"$2,334 ",1 day,2009,"Residential, Single Family Residence",Two Story,$148 ,"2,614",2,"Carpet, Ceramic Tile","Central, Gas","Central Air, Electric",1368,89115,Medium,Minimal,Minimal,Severe,Minimal
https://www.redfin.com/NV/Las-Vegas/3927-Saddlewood-Ct-89121/home/29474253,55,44,51,George E Harris Elementary School,4,William E Orr Middle School,3,Valley High School,1,"3927 Saddlewood Ct,Las Vegas,NV89121",344900,3,2,1942,"$2,479 ",1 day,1989,"Residential, Townhouse",One Story,$298 ,"4,356",2,"Carpet, Tile","Central, Gas","Central Air, Electric",1394,89121,Medium,Minimal,Minimal,Severe,Minimal
https://www.redfin.com/NV/Las-Vegas/1671-Apricot-Tree-Cir-89142/home/29400038,24,34,46,Dan Goldfarb Elementary School,6,Kathleen & Tim Harney Middle School,4,Las Vegas High School,3,"1671 Apricot Tree Cir,Las Vegas,NV89142",425000,4,3,2007,"$2,655 ",1 day,1993,"Residential, Single Family Residence",Two Story,0,"6,098",3,"Ceramic Tile, Laminate","Central, Gas","Central Air, Electric",1321,89142,Medium,Minimal,Moderate,Severe,Minimal
https://www.redfin.com/NV/Las-Vegas/4409-Bluecrest-Rd-89121/home/29426184,25,35,35,William E Ferron Elementary School,5,C W Woodbury Middle School,2,Chaparral High School,2,"4409 Bluecrest Rd,Las Vegas,NV89121",415000,4,2,1696,"$2,591 ",1 day,1973,"Residential, Single Family Residence",One Story,0,"7,405",2,Laminate,"Central, Electric","Central Air, Electric",1267,89121,Medium,Minimal,Minimal,Severe,Minimal
https://www.redfin.com/NV/Las-Vegas/3780-Garden-South-Dr-89121/home/29423141,68,42,58,George E Harris Elementary School,4,C W Woodbury Middle School,2,Chaparral High School,2,"3780 Garden South Dr,Las Vegas,NV89121",295000,2,1.5,1150,"$1,973 ",1 day,1972,"Residential, Townhouse",Two Story,$155 ,"1,742",2,Ceramic Tile,"Central, Electric","Central Air, Electric",618,89121,Medium,Minimal,Minimal,Severe,Minimal
https://www.redfin.com/NV/Las-Vegas/2050-Los-Feliz-St-89156/unit-121/home/28978310,19,31,4,Mountain View Elementary School,4,Dr. William (bob) H Bailey Middle School,3,Sunrise Mountain High School,1,"2050 Los Feliz St #121,Las Vegas,NV89156",289000,3,2,1202,"$2,001 ",1 day,2004,"Residential, Townhouse",One Story,$204 ,"4,782",2,Carpet,"Central, Gas","Central Air, Electric",803,89156,Low,Minimal,Moderate,Severe,Minimal
https://www.redfin.com/NV/Las-Vegas/2532-Olay-St-89142/home/29002109,12,40,27,Mervin Iverson Elementary School,6,Kathleen & Tim Harney Middle School,4,Las Vegas High School,3,"2532 Olay St,Las Vegas,NV89142",370000,3,2.5,1352,"$2,355 ",2 days,2005,"Residential, Single Family Residence",Two Story,$40 ,"2,614",2,"Ceramic Tile, Hardwood, Tile","Central, Gas, Multiple Heating Units","Central Air, Electric, 2 Units",1195,89142,Medium,Minimal,Moderate,Severe,Minimal
